,lista
510,@guuatever @LeidiPonzonia Las teorías anticíclicas que todo sindicalista que se precie defiende.
511,Me gusta sacarle una sonrisa siempre que uno le saca solo lágrimas (y)
512,"@dannyviLe Es la pelada. Si los estudios dicen que te hace más alto y más fuerte, seguro que también más joven"
513,"@solesalva lo mismo vos ,cuidate"
514,"@diverso_alex no, uruguay son 3 millones, no me siguen tres millones jajajajajajaj vos sos tarado? Te sigo si"
515,@KevinistaOk que egoísta de tu parte decepcionada
516,"@CataDiaz100 ah nno perdon mejor dormi t va a hacer bien, comete una bananita"
517,Esta lleno de mosquitos los odiooooo
518,Ya voy a juntar pastito y agua para los camellos de los reyes magos
519,@sergiouy52 lo sé Sergio. La dedicactoria te comprende por supuesto
520,@AntonellaMombru pq somos mejores y valemos más
521,@cuervotinelli @lourdesanchezok @elchatoprada que increíble !! Yo nací hace 36 años y nunca tuve Papá o padrino o algo... TREMENDO !!
522,Yo muchísimo mas . Hablamos al DM y te paso él apartado postal
523,@degeronimi @mercadopago muy bueno felicitaciones!! Se necesitaba
524,@grisel_ok muy bien y vos?ando con ganas de algo dulce
525,@ZockClient se suman los 2 clicks del mouse y de un click normal de 3 pasa a tener un click de 14 no son macros 2/2
526,Ya extraño romperle las bolas y peliarlas ya se que me extrañan tambien
527,"#LaUltimaPalabra Guillermo sos un tipo joven, fachero, andá al dentista a que te haga carillas abajo, cuando hablas solo veo eso"
528,me siento una esclava hebrea siempre sufriendo
529,@AntonellaMombru si igual si me vas a mostrar una foto no es nada pq prefiero las cosas saladas
530,Empezó a llover y me puse a cantar esta canción jaajjaja
531,"me preocupa la flacura de la china, posta. NO era asi de flaca ella"
532,@GramaticaReal por ejemplo si eres MANO larga jaja
533,Solo falta que me siga @CaELiKe Porque La argentina ya me sigue y Facu también
534,@alejandro_mhr el cine de Irán es de los mejores en el mundo
535,"@TiaEuge2011 siempre me gusta leer e informarme, por supuesto. De hecho no es q desconozca el tema, pero x supuesto. Gracias."
536,"@MonteroEnzo1899 hola soy joaquin y tengo aire, arre q no me anda"
537,Si gana Trump que pasará con la bonita
538,@selectornectar @eskartas un día de estos en que se acueste borracho lo volvemos dejar igualito!
539,hoy entro un poquito más tarde a trabajar #BuenDia
540,"pa en esta parte del año me pongo re melancólica, voy a extrañar tanto ver todos los días a las gurisas"
541,"@RissoConDosEsse Te voy a espoliar ahr no ,lo único que te voy a decir es que esta muy bonita, divertida y tiene un mensaje"
542,La verdad que me encanto el #McDiaFeliz en @mvdshopping Un placer estar presente para ayudar! @mcdonaldsuy
543,@freezedolan igual same estoy igual q vos con lo que pusiste el año que viene será
544,"@CAELIFANCY falta poco para tu cumple mi Cami ,te extraño"
545,@SantyTkd11 subi a la azotea por tu tweet y esta normal
546,@steinpipe @elgaita @mmacri1 @MarioVa52 Juntos y Rodeados de campanas
547,"@PALMERPATO Que lindo ""mundo""ése entre la profe de teatroa los 22,23,aue lindo....""nostalgias"""
548,Yo tengo él grupo perfecto de 7 chicas para ser IBFs grupales
549,Nada mas lindo que agarrarle el auto sin permiso y salir andar jaja
550,No tengo cargador que lindo
551,@grisel_ok como estas ? yo toda las noches ando por aca nena
552,#LosRicosNoPidenPermiso todas las parejas juntas como deberían estar menos la de #rafana voy a llorar
553,"Aparte me siguen las personas ""mas importantes"" de tw"
554,"@xkidas @diegodechena Te voy a liberar de mí, así dejás de lloriquear y protestar, chilena huevona. Chauuu"
555,"yo no puedo tener rulos ni con las cremas esas, pero me las pongo porque tienen rico olor"
556,"@RissoLula niña feliz cumple, que pases lindo"
557,"@elojodeava hay escabio gratis, pero igual dudo, es duro marchar..."
558,"@susanagladysfer si discrepa y deja su banca me parecería muy bien, pero así no me gusta, creo q es abuso. Besos, querida Susana."
559,Creo que lo peor del trabajo es tener que sacarme los anillos y la pulsera
560,días de frío = agua extremadamente fría para tomar
561,"@Chorros_uy Una consulta?, varios community manager están preguntándose como se hace para la denuncia del MI y así ganar más seguidores?"
562,Espero que sea el cargador el que este fallando y no el celu!! Me sale mas barato un cargador que un celular jajaja
563,Subiría una foto de mi boletín pero es muy mainstream y yo soy único y diferente
564,@elijuambeltz un canguro GAP como único aliado
565,"@Kanalla10 @negromagallanes disfrutá mientras puedas, q prontito se acaba."
566,@_suniac que ya no quedan diseñadores gráficos anarquistas?
567,"@milecorreaa pa bo te juro que no me di cuenta, te extraño enana"
568,ves esa sonrisa es falsa como tu amor
569,"@barsacampeon10 Qué horror, la mala suerte de esa pobre niña es tremenda... Pobrecita..."
570,se ve que no me conocen ni un poquito
571,muy sensible esta la gente hoy dia
572,"no se puede hacer ningun comentario che ,que feo"
573,Me quiero pelear con alguien y siento que ya estoy grande para andar en bardos
574,@NeckoLol Eu necko que lastima el lunes no se si me puedo quedar hasta tarde :u es dia de semana tengo liceo (secundaria)
575,"@loli_pontes yo me tomé este finde para planificar mi funeral nomas, salí los dos anteriores, si me hubieras dicho antes lo consideraba"
576,"@LovesDalasito uhh que lastima, bueno igual no podia ir a la firma"
577,"Mi celular él táctil esta roto ,entonces después de las clases lo voy a llevar a arreglar Así que pronto podre m…"
578,"@NinetalesGD leeel bueno, ahora hablas con mas personas"
579,Intendente #Flores @FEcheverria50 ¿Qué está haciendo para terminar #RuidosMolestos en #Trinidad? Los derechos de TODOS pasados por arriba
580,"Uruguay es caritativo, nosotros estamos segundos igualmente"
581,"@cuervotinelli el 27 de diciembre tengo mi primer sesión, luego el 11 de enero... NECESITO HACER ESTO POR MI PARA SENTIRME PLENO !!"
582,"@Solenrivero Puede ser, no soy histerico yo, asi que no puedo darte una opinion personal"
583,"La tía se levanto y me dijo "" madrugastes o te caistes de la cama?"" Y ni si quiera e dormido"
584,"Bueno, ya me cansé de poner en su lugar a esos muertos chilenos. Será hasta mañana, amigos"
585,"@xkidas @NCouto2000 @GonzaloCelis para nada, sólo estoy poniéndote en tu lugar: el de los mediocres q nunca tuvieron una copa mundial."
586,@mister__lemon Está el FA... pero no son profesionales
587,@KarennPladaa estamos en la misma soy pobre y sin ropa
588,@MarinesStrasser ahhhh es genial eso pero esytoy de viajeeeeee! beso y mucha suerte!!!
589,@Duarteftagus En Argentina el 1° de Diciembre
590,@gbudino venite a hablar de tus teóricos virtuales! vengan con otros de la cátedra! también de como usan las polimedias
591,@joacobolso y lo peor es que con los republicanos en el gobierno de EEUU el futuro está jodido mismo
592,"Cuando se acuerda me escribe, mas lenda"
593,@RochiisuarezBj No tenemos  Pero va a estar en todas las librerías del país y hay varias con tienda online
594,@LilianBertrand @sergiouy125 @jdelossantos201 nooooo obvio yo tampoco nunca jamasssss x eso me lo pregunto quienes fueron? Pero van 3gob
595,Joaco si ves esto te extraño
596,"@xkidas @NCouto2000 @GonzaloCelis Bicampeón? una copa comprada de local, otra inventada x la fifa conmebol. Saludos a Jadue."
597,Digamos que se me hizo un poquiiiito tarde leyendo noticias y escribiendo algo. Será hasta mañana
598,"@xkidas @bambootik @NCouto2000 @GonzaloCelis las tuyas ya se oxidarán, y no vas a ver nunca una siguiente."
599,"@xkidas @bambootik @NCouto2000 @GonzaloCelis copa 15 de América en 2011, cuartos en mundial 2010. Y Chile cómo anduvo en los mundiales?"
600,Voy a extrañar aquellas charlas infinitas!!!
601,Hoy la luna esta hermosa
602,Entre al coso cat ese y me descansan
603,Contestame cuando te pinte total
604,Yo sabía que la #SuperLuna traería efectos negativos #supermoonfail
605,@gracma hola nena tanto tiempo .como has estado?te cuento ? yo mas feliz no puedo estar hoy
606,Diría que estudio también Pero es mentira jajajaaj y yo por ahora mentiroso no soy y Odio Las Mentiras
607,"@Valezka38 dolor sería ser chileno, la mugre de América. Chupapijas de los ingleses y del pinocho. Cero copa mundial. Saluditos."
608,"@xkidas @NCouto2000 @GonzaloCelis claro q me miro al espejo, no soy un asco como tus jugadores terrajas"
609,"@cuervotinelli Me desperté medio mimoso porque soñé con vos !!, hasta cuándo duermo no te salís de mi cabeza ..."
610,#FollowMeHDOI por favor singanme estoy triste xq mis artistas favoritos no vienen a mi pais
611,@elsamariadelca1 ESCRITO de él para estos días 2Tes:2:9)con GRAN PODER y señales y prodicios mentirosos( ILISIONES fornicarias Ap:18
612,@Pkba88 @gabriel_hgs yo hice humanístico y salve matemática de pedo.
613,Agustin se fue y lo extraño
614,No hay chance de que empiece una dieta si todo es tan rico
615,@Cronistacom ESCRITO de él para estos días 2Tes:2:9)con GRAN PODER y señales y prodicios mentirosos( ILISIONES fornicarias Ap:18
616,@elsamariadelca1 ESCRITO de él para estos días 2Tes:2:9)con GRAN PODER y señales y prodicios mentirosos( ILISIONES fornicarias Ap:18
617,Quieren que les suba links de vídeos motivaciónales ? Les levantará él animo para los exámenes
618,Tengo las patitas frías cuando nos pensás visitar verano??
619,@Eeugenitaa gracias Pippi! (te conté que tu nuevo DT favorito fue mi DT de pendejo?)
620,@pr0duc3r ¿Podrías enviarnos tu mail de usuario por MD? Muchas gracias.
621,@Silperpetua era mas facil armar bardo
622,gracias a #RevistaShopNews por el permanente apoyo a nuestro programa de #TV
623,Otro día que me voy a dormir sin su mensaje de buenas noches
624,"@flor93_ Buenooo, feliz cumple querida!! Muchos zombies para usted"
625,yo se que me porte mal hoy pero quiero fav
626,Paaa jona te extraño primo firme
627,@ForgerPancake Lo trasladaremos al equipo correspondiente. Saludos
628,Por qué ya no aparece cuando le doy like a un video
629,"@cuervotinelli toy en San jose Papá, vine a ver una amiga, recién tamos almorzando , Tqm;3, te veo luego..."
630,@bostonriver de parte de un parcial de Fenix.. mucha suerte y ojala clasifiquen a la sudamericana
631,@BibliotecasCes @PuenteCelsa @mldefran Y luego los chicos nos podrían dar clases de robótica a ños grandes
632,"Los/as uruguayos/as son muy amables. Nadie ha intentado echarme el auto encima en los ceda el paso, al contrario, lo ceden sin problema"
633,""" Nunca digas de esta agua no beberé, porque el camino es largo y te puede dar sed "" buen descanso Byeee"
634,tengo que ir a pando por tercer día consecutivo
635,@DianiDeMG ¡Qué bueno! Esas sorpresas emocionan
636,.@PedroBordaberry El Senador itinerante... hay que darle una medalla a su médico personal; no cualquier octogenario aguanta ese trote
637,Pa yo soy eel mas gil me podes hacer mil jodas que siempre ccaigo
638,"Se Viene Tiempos Dificiles , Pero Me La Voy A Bancar Piola"
639,""" Todo fracaso es condimento que da sabor al éxito "". que tengan un hermoso #viernes comienzo del #findesemana"
640,Determinar desde temprano que hoy será un gran día. #BuenViernes al que lee
641,@Phoyu_Agustina u.u Perdon Es que estaba loquito y Di todos los Unfo perdon
642,@jugudik Reportate donde adas? Da señales de vida ¡Por Favor!
643,Mojo Jojo hizo gigantes a las chicas superpoderosas y ahora no pueden combatir el crimen sin destrozar media Saltadilla
644,"@MarBerrondo2 jajaja hacelo por mi, yo estoy insertada estudiando.."
645,"Había un sueño medio soñado, había un bueno, había un feo, había un malo"
646,@FerrCarrillo ta re grande y Preciosa !! Bien Logrado  ...
647,yo quiero que dios me ayude a conseguir el libro rapido
648,es re triste q a todo mi inicio le pongan cosas en el cc y a mi no
649,DEVUELTA EMPATE LA CONCHA DE SU MADRE Los duels seran contra ustedes no en unranked aviso Mary perdon pero no quieren skywars
650,"se me borró todo lo de la tarjeta de memoria, toy por caer en depresión miles de fotos maso, la puta madreeeeee"
651,Estoy triste y no se xq
652,@cbaballe2 me acabas d romper el cora pero igual es el mejor del mundo jeje
653,"Sé tan fuerte que nadie pueda herirte, tan noble que nadie pueda ofenderte y tan original que nadie pueda imitarte."
654,Querés saber sobre el tiempo? Seguí a @matiasrivero21 Un tipo piola y de buena onda #Meteorología #Uruguay
655,@EnzoGrilloB Lo tengo en Febrero igual jajaja
656,@Silperpetua que lindo no? Buen dia
657,"@vmayo72 ah bueno, desp poné foto, seguro va a estar recontra buena!"
658,@improbable qué lindo que hayas dicho que sí!
659,@larunego @DestacadosUY Pronto subiremos una convocatoria para que los lectores formen parte Gracias por preguntar Laurita
660,@larunego @DestacadosUY ¡¡Qué bueno!! Su trabajo es increíble y esperamos reciba mucho apoyo. Nosotros esperamos sorprenderla
661,Quien no puede dormir y tiene q trabajar temprano
662,@racosta86 a ese Sr le veo cara conocida...
663,@LuzuGames Que bueno! porque me perdí el directo
664,Estoy aburrida ... Y nadie esta conectado Bueno CE siempre esta conectad@
665,@PedroPereiraHrs gran fórmula. Esto no es una fórmula. Esto es un tuit.
666,"Piensa en grande y tus hechos crecerán, Piensa que puedes y podrás. Todo esta en el estado mental. #BuenFinDeSemana"
667,11:30 juega el dortmund y 12:15 es el clásico de españa y no voy a poder mirar ninguno de los dos
668,@AndreaLuzuriaga me rompisteS el corazón! es una discusión ardua la del horario; no podés acomodar para entrar a las 11 algunos días?
669,"@DeVersalles lo sigo y lo leo ,tenga hermoso descanso ,se cuida gracias"
670,@castondarx ay lo extraño lola decile que venga
671,"@cuervotinelli se le caen los dientes al Payaso Bobito :/, PAPÁ VENI TENGO MIEDO ... !!"
672,Lo que una hace de noche aburrida y muerta de calor... 100% real no fake
673,@Iri_Becaria Está llegando a Argentina. En estos días andará por todos lados seguro
674,Estoy feliz xq esta lloviendo
675,los argentinos son re lindos todos
676,"@liliramos6 Fuerzas nena ,el esta en un lugar maravilloso ,vos no estas sola en este momento ,estamos nosotros para acompañarte"
677,When sos especial Después hagamos skype
678,"@pedroalfonsoo @cuervotinelli ufffff !! Que bajón , me lo estoy perdiendo...,ME VOY A PEDALEAR CON GOMAS NUEVAS"
679,"@gianmaradona jajaa no digas eso ,sos muy joven"
680,Cuando termine de hacer skype con Irene quizá haga YouNow PD:Estoy nerviosa.
681,Toda la noche soñando con caballos que hermoso fue
682,Los globos verdes se re pierden con el mosaico ese
683,"@aldanaperezz Tengo ganas de salir a caminar, quiero verlas las extraño ajajjajajaja"
684,@pepi_goncalvez @Camilo99fuegos Pepi! Me encantó la Sonora 99 Fuegos! Esperemos volver pronto. Un abrazo grande para ti y gracias !
685,@skyimpson me la olvide pero tengo la huella y no em deja usarla nose
686,@NachoDantaz Traicionado por la mujer que me dio la vida
687,"No necesitas demasiadas personas para ser feliz, tan sólo a las personas reales que te aprecian por lo que eres. #buenasnoches"
688,Yo queria ta cabron tambien
689,"@GhetsisD Hay que disfrutarla al màximo mientras pueda ,despuès se hacen grandes y vuelan Doc"
690,quiero que mariano le de el regalo a joaquin
691,"@Flor_uy @igalvar71 nuevamente, pensamos distinto.Para mí son a la vez solidarias y se benefician. Van de la mano, no son contrarias"
692,No para nunca de tatuar a Ghi y tengo tremendo sueño
693,@happyviciconte Gracias Gil Tambien Te quieroo
694,"Esta es mi nueva cuenta ,si quieren seguir me vallan ... PD:No quiero personas enojadas o bloqueos ,gracias"
695,"@Eeugenitaa @florbst emmm, feliz cumpleaños! (era eso?)"
696,@DrYombi Arriba que entonces no todo está perdido. Lo que sea que buscás te va a salir vas a ver
697,"Vivimos en una sociedad donde mentir se volvió rutina, traicionar en monotonía y ser hipócrita es la ropa de hoy en día. #buendescanso"
698,@_melibarra es una frase digna de chiquititas 98. y es cierta
699,"@elsharpo @Bambino627 creo lo mismo . Ojo igual respeto, incluso comparto algunos valores. Pero gracias a dios, SOY ATEO"
700,"@cuervotinelli Que descanses Papá de mi corazón!!, siempre es lindo verte  ..."
701,Han pasado 5 min y no hay nadie Estoy en vivio mi YouNow es Manuela Etchebarne
702,"En el prado con mi gente, esto necesito"
703,Todo lo bueno que pase en el año. Poco a poco se esta perdiendo... Ups and downs...
704,A todos se les antojo que les hablara a wpp o snap hoy y tengo que recordarles que mi cel esta roto
705,Se está perdiendo la costumbre de valorar los pequeños detalles nunca los dejes de lado #Lunes
706,Me duelen horrible los pies
707,"Agarro la cuadernola para estudiar y enseguida empiezo con sueño, me aburro, agarro el celular, todo me distrae en ese momento LITERAL."
708,feliz pq me tocó ventanilla y el asiento esta roto
709,pasando un tarde hermosa en mercedes mirando la ciudad desde lo mas alto
710,Votamos por #SiNoEsMuyTarde de #LucianoPereyra @RADIOPOPULARSL Fans Club Oficial Internacional @tuselegidas
711,es re gracioso como encuentro ARMYS en todos lados. levanto una piedra y salen 10 armys
712,"@FS_OL_Qbnfangrl Hoollii!! Acá descansando, después de un día muuy largo lleno de trabajo"
713,"@old_sound sigue siendo laico, no te preocupes"
714,@Flopi_Soberon lo mejor es ni aparecer por el tl señora
715,Prefiero Lamentarme Solo Lo Que Esta Pasando
716,"Me puse re mal con lo del avion con jugadores de futbol chapecoense,pobres familias la vida es injusta QEPD y fuerza familias.."
717,Que día de tragedias la verdad..ahora el falso simulacro del bps que termino siendo real
718,Corte pienso y me imagino estar ahí y faaa que mierda locooo .. #FuerzaChapecoense
719,"@mister__lemon @Goberlik @derraeb Dicen que escribió ""cuando sea grande quiero ser como vos"""
720,Estoy muy sensible! Triste por lo de hoy! El futbol este de luto
721,"Lo ame a Carlos x ir fuerte, muy fuerte en moto."
722,@mvdsister Que buena pinta!! Un buen vinito y estamos!
723,"Estoy en tremendo ruido firme , todavía no puedo creerlo !, #Chapecoense"
724,@matiasrivero21 Matíasss...empezó la tormentaaa!! Truenos y llovizna ...ayer sismo....QUIERO SALIR CORRIENNNDDDOOO!!
725,Les gustarían edits así? Tratare de aprender como se hacen y aprender mas técnicas de edición La queen de Sel …
726,@yoparami @LuJVS existe una app para encontrar baños públicos pero es inútil
727,"@cuervotinelli Buen día Papá hermoso !! ;3, Que tengas un lindo Domingo"
728,Les juro que estaba nublado y me puse protector pero no puedo dormir porque no puedo apoyar la cara en la almohada. Quiero ser negra
729,Se me pego toda la comida JAJAJA lloro ah
730,"Si crees en tu propio éxito, lo obtendrás; confía en ti. buenas y lluviosas noches , #netflix , byeee"
731,Buena peli voy a mirar yo ante de ti
732,El año que viene me tengo que volver a hacer el carnè de salud..pero esta vez un poquito diferente
733,Si todo fuera distinto seria mejor
734,Yo amo ser mujer..pero en casos así digo xq mierda fui mujer loco..
735,que contracturado tengo el cuello
736,Buen día!!!..toda hecha mierda gripe maldita pero..bañito y a trabajar se a dicho..
737,no me puedo dormir odio que siempre me pase esto loco
738,"@sepuedevivir la amo, qué hay de cierto en que a las serpientes nos dan cascotazos todo el año? 2016 fue suficiente... Tierra here"
739,"@Nifunifa4 siempre hay algo para hacer, no sea vaga"
740,@virginiagy8 lástima que no podemos decir lo mismo de la otra Ámsterdam
741,"@cuervotinelli ESTOY MUCHO MÁS FLACO ^_^, toy contento !!, cuánto medís vos Papá??,yo 1.87 descalzo"
742,"Quien no llama a #Fidel como #Dictador. Quien justifica SU DICTADURA ¿luego habla de: Democracia, DDHH y libertades? Dan vergüenza ajena"
743,@tbotmakers Que bueno que descubrieron mi bot Cuando quieran meter algo en @ProductHunt avísenme y los ayudo!
744,@Laa_ceciper hola bonita como estas me gustaria conocerte saber de ti
745,"@GiuliJs7 camara del orto esa, yo solo queria un icon"
746,"Qué ganas de joder Fidel, si ya teníamos el programa del martes todo armadito! cc: @Tedigolaotra"
747,"@lizytagliani hace dos minutos te vi ,a vos y tu bailarin hacer el aguadance Felicitaciones son lo mas ,segui asi"
748,@grumimantis20 lo digo en serio me rompes el corazón
749,"@Pkba88 @losbidones recién veo toda la discusión, larguísima! (yo ya tengo novia! )"
750,Paro de transporte en Montevideo hasta las 22:00 horas por agresión a ómnibus por el clásico
751,"Literalmente estoy destruida ,perdón no hacer YouNow Es que realmente me siento súper mal."
752,Escucharle la voz antes de dormir. Lo mejor
753,Química de 6to aprobado con 6 una menos por suerte
754,"@sebacancinos Perfecto, muchas gracias por dar el aviso. Vamos a consultar con el equipo de tecnología. Saludos"
755,Hasta quien sabe cuando no vuelvo a entrar ! -_- me re enoja
756,"@pablocardozo_uy bueno, no lo conozco, me emocionó si, y en todos lados está lleno de hijos de puta que a veces hablan bien"
757,@cedrezzz no tengo celular hace dias hablame md
758,@mateosere nooo me encanta Reality qué espectacular!!
759,@RobleisIUTU hola compartí el video y grax por decir que eras hay me sino orgulloso de que admitas tu contento salúdame en el otro
760,Num y te tiro una indirecta con tu user ME ABURRO
761,Uff..no..no estoy feliz..teléfono de mierda que me despertó de mi sueño hermoso..
762,Te desearía lo mejor pero ya lo tuviste
763,Nada más triste que te dejen plantada con el porro armado
764,Todo mi inicio es hablando de Animales Fantásticos
765,"Quiero empezar el curso ya, Dios estoy emocionada"
766,caro no quiere mas a su amiga
767,"@GhostHunter342 @Batalla_Epica Kratos igual, recuerda que ahora está en la mitologia nordica"
768,Siento que algo malo va a pasar o paso..ahí que instinto de mierda..que se apague que quiero intentar dormir
769,@barossi_luzmila cosas de la vida me decis soy la mas fracasada del mundo osea no le cuesta anda un hola que importa que sea famoso
770,"Hoy la luna esta hermosa ,plena"
771,"@julirod14 Lástima que ya terminamos las clases, quedó pendiente el Mannequin Challenge ..."
772,"@andreacarcamo7 solo vi hasta los primeros caps de esa temporada y me re decepcionó, tan buena que era la serie y la aburrieron"
773,@capPu1550 @alitamontevideo @klarita56 pero es uno de los preferidos
774,@mariapiasilva12 pasaste con 11 be happy jajaj felicitaciones te amo
775,Leo me consigue novios jajajaa bastaaaa quieroooo estar sola!
776,@Jime_Rodriguez6 estudie con quien estudie es estudiar igual
777,"@cuervotinelli Que descanses !!, Tqm ..., re lindo el programa de hoy @elchatoprada @hoppefede  !!"
778,@BrunaSosa7 Te Extrañoo y muchooo vuelveeee yaaa
779,Un abrazo es un poema escrito en piel..
780,@ciudad_com @MarceloPolino @pampitaoficial @AngeldebritoOk @valientesoledad Todos intoxicados por envenenamiento jajjajajja !!!!!!
781,PeroFuiste mi primera mascota.....Te di tu primer baño y te cuide Pero son cosas de la vida pero ahora tengo a M…
782,ay no hablen que el año que viene termino la secundaria
783,El ingenio yorugua... Me divierto mucho.
784,"@KarenTabarez No, yo no soy importante"
785,Me hace muy feliz ayudar Y mas si son Caelikers de uruguay porque hay dos que yo conozca @CaeliUru y yo
786,"@SilvioCABJ12 Vamos! a más viejitas mejor, pero no se por quién apostas?!"
787,@LiaTitoo Graciaas!! Vos también te lo merecías Fue re lindo tener una compañera como vos
788,"Puedo estar rq, q me tira dos tw y me re puede d nuevo"
789,Era más fácil ir hasta el cuartito de utileria y traer una red nueva
790,@davusito no hay tal pussy chaval ajajajajajja pero chingao seas si estabas con tus amigos
791,@fernando_amado Estoy ofendido de que ni @Chasquetti ni @Constanza_FA hayan querido reclutarme. No logré llegar a estándares soviéticos
792,ay loco que mierda justo el que pensé que era buena gente..
793,@dalasito2003 pero estaba en youtube igual twitch se me tranca todo
794,"Nose no cuantas veces me caí este año, pero me caí literal! Bueno, metafóricamente también"
795,Gobierno venezolano usando a #Chávez más que Disney a Pluto o a Goofy #ElFaltante #CerrayVamos #Maduro #Villegas…
796,"@LicenciadaCata Lost in Translation Le buscaron un título más ""marketinero"" Slds y buen fin de semana!!"
797,@andresantoniuk @LaPasiva lindo loop-hole para forzar efectivo sin ser sancionados Hats off.
798,"Holaaaaa chicos, volvi como estan¿ yo bien aca en mi querido hogar ABURRIDA y ustedes que hacen¿,cuenten chiquilines jaja"
799,"@candetinelli TE AMO BOLUDA!!, y lo sabes... Bien metida !!, me haces reír ..."
800,Quiero una Skin de un traje de una vaca pero no encuentro lloro
801,"Mañanaaaa es festivo en Colombia, que envidia"
802,@ias25viki les tengo alergia (?) ah hacia problema por todo
803,@sanper11 Hoy envié esa misma pregunta por WhatsApp a @NoToquenNada para @borisgolu10 pero no se la preguntaron no se mira el retrovisor
804,"Paaah, extrañaba tanto a Ezee... Estaba re perdido."
805,"Espero que @Uber_UY no me pida que la borre y la agregue de nuevo, son demasiados números para escribirlos de nuevo"
806,"@amorins8 jajaja, un poco necrófilo pero bue..."
807,Yo le compro una milanga al que me acompañe jaja no quiero ir solo hoy.
808,nadie quiere ir al prado
809,"@msfernandezrial Hola Sol, ¡Disculpas! ¿Recibiste el pedido? Siempre que tengas dudas está disponible nuestro chat online"
810,"@Yannisame jajaja, le gusta el vino tinto! hace años me respaldó un proyecto y a modo de agradecimiento le mandé un vino uruguayo"
811,"Ya perdimos al tío y ahora la abuela en estado grave ,preciosas fiestas voy a pasar."
812,"@lamascarada @cuervotinelli tal cuál :/, No seas malo Papá..."
813,Se fue Charlotte no miro mas ese programa era por la única que miraba showmatch
814,@AliciaVery no conozco nada pero se que es un lugar màgico
